no,company,inspector,location,date,vendor,raw_content,corrective_action,is_completed,photo_before,photo_after,remarks,SDN_risk,Hanmi_risk,SDN_score,Hanmi_score
1.0,Hanmi,Rahul Mor,Module 1F,06.03.2026,DSHI,"Risky & unsafe condition/Safety voilation Hundred percentage (100 %) height of scissor lift was used/opened, that significantly impact the stability and safety of the equipment. Center of gravity moves higher,Tip over hazard",Use/Allow upto safe limit of scissor lift (not more than 80%) to avoid the tip over hazard,Yes,20260306_SDN_002_before,,Overturning,전도/낙하/부딪힘,전도,1.0,1.0
2.0,Hanmi,Surender Kumar,Module 2F,06.03.2026,Hankuk,Toe board were not installed in the scaffolding area to avoid material falling,Need to install toe board in all scaffolding platform,Yes,20260306_SDN_001_before,,Dropping,떨어짐/낙상,추락,0.4254,0.4185
3.0,Hanmi,Surender Kumar,Module 2F,06.03.2026,Hankuk,"Uneven /Unsafe gap in the scaffolding planks,materials can fall down",Do rearrangements for these scaffolding planks.,Yes,20260306_SDN_003_before,,Dropping,전도/낙하/부딪힘,낙하,0.4051,0.3986
4.0,Hanmi,Surender Kumar,Module 2F,06.03.2026,Hankuk,Worker was standing on jack/Props in unsafe manner at height,worker need retraining & he should work by standing on safe platform only,Yes,20260306_SDN_004_before,,Falling,전도/낙하/부딪힘,추락,0.4573,0.4689
5.0,Hanmi,Surender Kumar,Module 1F,06.03.2026,Hankuk,"Worker was standing on jack/Props in unsafe manner , can slip & will get injury in this unsafe position",worker need retraining & he should work by standing on safe platform only,Yes,20260306_SDN_005_before,,Falling,전도/낙하/부딪힘,추락,0.4817,0.4399
6.0,Hanmi,Rahul Mor,Module 1F,06.03.2026,DSHI,Loose middle platform was used to stand over in the scissor lift on extension platform,Loose middle platform must tied/clamping both sides,Yes,20260306_SDN_006_before,,Falling,전도/낙하/부딪힘,추락,0.5614,0.5423
7.0,Hanmi,Rahul Mor,Module 1F,06.03.2026,DSHI,"Near Miss  One near miss happened, fall of heavy bolt from scissor lift from height also underneath area was not barricade but no one was harmed",Need retraining for workers to work carefully at height and the underneath area must be barricade & no unauthorised entry should be there in the working area,Yes,WhatsApp Image 2026-03-06 at 10.13.23 AM,,Dropping,전도/낙하/부딪힘,낙하,0.49,0.5473
8.0,Hanmi,Rahul Mor,Module 1F,06.03.2026,Hankuk,Many workers knotted their safety harness lanyards which significantly reduce the strength of fall protection euipments,Need retraining for not to make knots in safety harness lanyards,Yes,KakaoTalk_20260306_164706114_08,,Impact,전도/낙하/부딪힘,충돌,1.0,1.0
9.0,Hanmi,Rahul Mor,Module 2F,06.03.2026,Hankuk,"Worker is moving at height without anchoring safety harness in lifeline,he holded the snap hooks of safety harness in his hands",Worker should use the safe anchor point for safety harness,Yes,KakaoTalk_20260306_164706114_07,,Falling,떨어짐/낙상,추락,0.4253,0.4724
10.0,Hanmi,Rahul Mor,Module 1F,06.03.2026,Hankuk,Worker was using hand tool at height without the tools lanyard,All hand tools must be tied with tools lanyard at height to  avoid fall of materials from height,Yes,KakaoTalk_20260306_164706114_06,,Dropping,전도/낙하/부딪힘,낙하,0.3467,0.5186
11.0,Hanmi,Rahul Mor,Module 2F,06.03.2026,DSHI,"Worker was standing on height (14meters) on narrow beam & anchor point (lifeline) is also far from him, risky condition to walk & work , high chances of fall from height",Worker must use safe platform to stand/work at such height also need secondary fall protection other than only 16mm pp rope (lifeline),Yes,KakaoTalk_20260306_164706114_16,,Falling,떨어짐/낙상,추락,0.5501,0.5939
12.0,Hanmi,Rahul Mor,Module GF,07.03.2026,DSHI,"Two filled oxygen cylinders were found with single chain going to lift,high chances to imbalance the high pressure gas cylinders at height during lifting",",instructed to tied properly & make safe position for lifting or use other safe method for shifting /lifting",Yes,,,Dropping,전도/낙하/부딪힘,낙하,0.3295,0.309
13.0,Hanmi,Rahul Mor,Module 2F,07.03.2026,Hankuk,"Materials from near access way needs to be clear, all area were lacks of proper safe access,materials scattered in haphazard manner.","Make Safe access way for all working area , clear the debris & other materials from near accessway",Yes,,,Falling,전도/낙하/부딪힘,낙하,0.5655,0.5442
14.0,Hanmi,Rahul Mor,Module 2F,07.03.2026,Hankuk,"Lifeline pp rope were substandard ,damaged & burnt at many points,also having inspection tag after so much damaged,there are no use /value of inspection if after inspection we find this type of damaged rope as lifeline as height",Need to replace all damaged & burnt lifeline & reinspection to be done by competant person for the new lifeline.,Yes,,,Falling,떨어짐/낙상,추락,0.4863,0.5418
15.0,Hanmi,Rahul Mor,Module 2F,07.03.2026,DSHI,Work was going on at height but underneath area was not barricade & No signalman was near there.,All equipment should be controlled by signalman during movement or working & beneath area must be cordoned off.,Yes,,,Impact,전도/낙하/부딪힘,충돌,1.0,1.0
16.0,Hanmi,Rahul Mor,Module 1F,07.03.2026,DSHI,"Multiple beams were without side support ,risky & unsafe position for beams placement,chances of fall of beams on nearby workers due to imbalance",Need to provide side support for the beams for both sides.,Yes,,,Collapse,전도/낙하/부딪힘,붕괴,1.0,1.0
17.0,Hanmi,Rahul Mor,Module 1F,09.03.2026,DSHI,"Tools boxes were without any material information sheet & materials from behind tool boxes were nor removed,wheels were no there for shifting ,no barricade , directly placed on ground","Material information sheet to be displayed ,need to barricade the area ,housekeeping to be done",Yes,,,Falling,전도/낙하/부딪힘,낙하,0.5143,0.5263
18.0,Hanmi,Rahul Mor,Module 2F,09.03.2026,Hankuk,Risky unsafe position working just near edge area at height,Kindly follow safe height work procedure,Yes,WhatsApp Image 2026-03-09 at 10.22.20 AM,,Falling,전도/낙하/부딪힘,추락,0.4685,0.5001
19.0,Hanmi,Rahul Mor,Module 2F,09.03.2026,Hankuk,Sharp edges in access way,Kindly provide Insulation for all sharp edges,Yes,,,Impact,전도/낙하/부딪힘,충돌,1.0,1.0
20.0,Hanmi,Rahul Mor,Module 2F,09.03.2026,Hankuk,"Worker was walking at height in unsafe manner just near the edge , no anchoring of safety harness,talking on mobile while walking",Retraining need for this worker for safe height work procedure & do not use mobile phone during walking & working,Yes,,,Falling,떨어짐/낙상,추락,0.4868,0.5132
21.0,Hanmi,Rahul Mor,Module 2F,09.03.2026,Hankuk,Substandard damaged lifeline ( pp rope) without any inspection used at height,Kindly replace the lifeline with standard one.,Yes,WhatsApp Image 2026-03-09 at 10.38.53 AM,,Falling,전도/낙하/부딪힘,추락,0.4424,0.4933
22.0,Hanmi,Rahul Mor,Module 1F,09.03.2026,Daemyoung,"Unattended Material name tag ,inspection date expired on 31.01.26 but still displayed,irresponsible behaviour",Kindly remove the document & also update as per reuirement,Yes,,,Others,기타,기타,1.0,1.0
23.0,Hanmi,Rahul Mor,Module 1F,09.03.2026,Hankuk,"Uneven staking of scaffold pipes (Standards),moreover the area was not barricade/isolated","Do not stake the material at unsafe height or in uneven manner, arrange properly",Yes,,,Collapse,전도/낙하/부딪힘,붕괴,1.0,1.0
24.0,Hanmi,Surender Kumar,Module 1F,09.03.2026,Hankuk,The rounds from web sling were not removed before start lifting,Do follow safe rigging method,Yes,WhatsApp Image 2026-03-09 at 3.25.14 PM,,Dropping,전도/낙하/부딪힘,낙하,0.2651,0.2906
25.0,Hanmi,Surender Kumar,Module 1F,09.03.2026,Hankuk,The locking pin of shakle was not properly tied,"Do not lift the loose materials/rigging equipments,kindly do proper check before lifting",Yes,WhatsApp Image 2026-03-09 at 3.26.56 PM,,Dropping,전도/낙하/부딪힘,낙하,0.3419,0.3039
26.0,Hanmi,Surender Kumar,Module 1F,09.03.2026,DSHI,Unsafe handling og gas cylinder by single worker,Do follow safe material handling methods,Yes,WhatsApp Image 2026-03-09 at 3.28.06 PM,,Explosion,화재/탄화,폭발,1.0,1.0
27.0,Hanmi,Surender Kumar,Module 1F,09.03.2026,DSHI,"Wrong position of d shakle,unsafe rigging method",Kindly follow safe rigging method,Yes,WhatsApp Image 2026-03-09 at 3.29.46 PM,,Dropping,전도/낙하/부딪힘,낙하,0.3332,0.3548
28.0,Hanmi,Rahul Mor,Module 1F,09.03.2026,DSHI,Risky access /Safety voilation unsafe loose staircase type platform using without clamping/tighten moreover the height of the staircase type platform was above the middle railings of scissor lift which is not allowed,"Do not allow this type of substandard platform above the middle railing, decrease the height & do proper clamping/tighten",Yes,WhatsApp Image 2026-03-09 at 3.57.51 PM (1),,Falling,떨어짐/낙상,추락,0.5218,0.5725
29.0,Hanmi,Rahul Mor,Module GF,10.03.2026,Halim,Materials storage container   Pvc conduit pipes installed which are not allowed & no installation of roof modular fire extinguisher & smoke detectors done,Pvc conduit pipes to be replaced withG.I conduit pipes & need to install roof modular fire extinguisher & smoke detectors,Yes,,,Fire,화재/탄화,화재,1.0,1.0
30.0,Hanmi,Rahul Mor,Module GF,10.03.2026,DSHI,"Deck sheet shifting work going on by workers only , no supervision by safety engineer or site engineer","Kindly increase supervision for the risky activities like lifting , Site engineer & safety person should be there during lifting",Yes,WhatsApp Image 2026-03-10 at 9.18.58 AM,,Impact,전도/낙하/부딪힘,충돌,1.0,1.0
31.0,Hanmi,Rahul Mor,Module GF,10.03.2026,DSHI,Using stand core drill machine  No safety inspection tag is there  No body earthing connection for stand core drill machine has been given  No authorized person (operator) details displayed on machine or nearby ,"Kindly provide inspection tag , body earthing,opearator details",Yes,WhatsApp Image 2026-03-10 at 9.25.23 AM (1),,Electric shock,감전/합선,감전,1.0,1.0
32.0,Hanmi,Rahul Mor,Module 2F,10.03.2026,DSHI,Shifting of deck sheets started by spider crane ( Mini crawler crane - 3 ton )  Beneath area was not controlled properly  Unauthorized entry was not banned  Both signalman were stand together & didn't stop any Unauthorized person  Unsafe handling of deck sheets by upside persons also ,"Kindly isolate the lifting/shifting area , No Unauthorized entry should be allowed during lifting,do training for handling the deck sheets at height safely",Yes,WhatsApp Image 2026-03-10 at 10.07.31 AM,,Impact,전도/낙하/부딪힘,충돌,1.0,1.0
33.0,Hanmi,Rahul Mor,Module 2F,10.03.2026,Hankuk,"The gap between lifeline posts is much than safe, the gap needs to decrease & much number of lifeline posts needs to install for safe use of lifeline at height ",Kindly do rearrangements for safe anchoring of lifeline posts,Yes,,,Falling,떨어짐/낙상,추락,0.329,0.412
34.0,Hanmi,Rahul Mor,Module GF,11.03.2026,DSHI,"Stand core drill machine ( Metal body )  Still body earthing not provided, need additional body earthing for operator safety  Unauthorized person operating the machine ","Kindly provide additional body earthing for stand core drill machine and authorised person only operate the machine , display the details",Yes,WhatsApp Image 2026-03-11 at 8.52.50 AM,,Electric shock,감전/합선,감전,1.0,1.0
35.0,Hanmi,Rahul Mor,Module GF,11.03.2026,DSHI,"Three Fire hydrant access is blocked ??,  materials scattered nearby in haphazard manner",Clear the materials from nearby & infront of all fire hydrant system for emeregency purpose,Yes,WhatsApp Image 2026-03-11 at 8.55.20 AM,,Fire,화재/탄화,화재,1.0,1.0
36.0,Hanmi,Rahul Mor,Module GF,11.03.2026,Daemyoung,"PDB access is blocked ??,  materials scattered nearby & infront in haphazard manner, Inspection checklist is not up to date","Kindly clear the access way for PDB, update the inspection checklist on daily basis",Yes,WhatsApp Image 2026-03-11 at 9.00.57 AM,,Fire,화재/탄화,화재,1.0,1.0
37.0,Hanmi,Surender Kumar,Module GF,11.03.2026,Hankuk,Shuttering board was shifted by workers on shoulder without using shoulder pads,Provide job specific PPE,Yes,,,Impact,전도/낙하/부딪힘,충돌,1.0,1.0
38.0,Hanmi,Rahul Mor,Module 1F,11.03.2026,DSHI,Tool boxes & other nearby materials stored without materials name tag/material information sheet,Provide /display material information sheet,Yes,WhatsApp Image 2026-03-11 at 9.21.07 AM,,Others,기타,기타,1.0,1.0
39.0,Hanmi,Surender Kumar,Module 1F,11.03.2026,DSHI,Material were found out of the scissor lift body in unsafe manner,All materials or person should be inside the scissor lift body during work at height,Yes,,,Falling,전도/낙하/부딪힘,낙하,0.5587,0.4801
40.0,Hanmi,Rahul Mor,Module 2F,11.03.2026,Hankuk,Materials scattered in access way in haphazard manner,Clear the access way from all extra materials,Yes,WhatsApp Image 2026-03-11 at 9.36.11 AM,,Falling,전도/낙하/부딪힘,낙하,0.5445,0.4886
41.0,Hanmi,Rahul Mor,Module 2F,11.03.2026,Hankuk,"Railings is not available,  unsafe opening ","Close the opening area, provide railings ",Yes,WhatsApp Image 2026-03-11 at 9.46.38 AM,,Falling,전도/낙하/부딪힘,추락,0.4222,0.3605
42.0,Hanmi,Rahul Mor,Module 2F,11.03.2026,Hankuk,Instructed to install guard railings this area due to unsafe opening or unsafe working position,Kindly provide hard barricade,Yes,WhatsApp Image 2026-03-11 at 9.50.18 AM,,Falling,떨어짐/낙상,추락,0.3904,0.445
43.0,Hanmi,Rahul Mor,Module 1F,11.03.2026,DSHI,"according to safety standard , this is Unauthorized, non-OEM platform ( Self- fabricated at site by DSHI ) extension using ropes and untested steel. This creates a critical risk of structural failure, machine tip-over due to shifted center of gravity, and falls from height as the makeshift guardrails cannot support a person's weight.","Kindly use alternate safe option - Boom lift,mobile scaffolding etc.",Yes,WhatsApp Image 2026-03-11 at 1.37.46 PM,,Collapse,전도/낙하/부딪힘,붕괴,1.0,1.0
44.0,Hanmi,Surender Kumar,Module 1F,11.03.2026,Hankuk,Material scattered in access way,Kindly clean the access way & remove the materails,Yes,,,Falling,전도/낙하/부딪힘,낙하,0.5548,0.4857
45.0,Hanmi,Surender Kumar,Module 1F,11.03.2026,Hankuk,Material shifting box placed in uneven manner on woods,The placing of material shifting box should be evenly,Yes,,,Impact,전도/낙하/부딪힘,충돌,1.0,1.0
46.0,Hanmi,Surender Kumar,Module 1F,11.03.2026,Hankuk,"Unauthorized personnel were not removed from lifting work area, access was also blocked in uneven manner",Remove the unauthorised person from lifting work area & access should be there other than lifting work range area,Yes,,,Impact,전도/낙하/부딪힘,충돌,1.0,1.0
47.0,Hanmi,Rahul Mor,Module 1F,11.03.2026,DSHI,During deck sheets shifting work web sling tighten with sharp edges wire which may lead to damage of web sling ,Use shakle instead of sharp edges wire,Yes,,,Dropping,전도/낙하/부딪힘,낙하,0.3691,0.4226
48.0,Hanmi,Rahul Mor,Module 1F,11.03.2026,Hankuk,Incomplete scaffolding(No guard rail) with green tag ,Kindly provide red tag for theincomplete scaffolding,Yes,,,Falling,떨어짐/낙상,추락,0.5294,0.5242
49.0,Hanmi,Surender Kumar,Module 2F,11.03.2026,DSHI,Unsafe opening near edge area was not barricade or blocked,Need to provide temporary barricade for now & then hard barricade for all area ,Yes,WhatsApp Image 2026-03-11 at 3.35.19 PM,,Falling,전도/낙하/부딪힘,추락,0.4575,0.4284
50.0,Hanmi,Rahul Mor,Module 1F,11.03.2026,DSHI,"Scissor lift crossing over safety net, operating by standing over safety net ,It will decrease the strength & integrity of the safety net. The tires of the scissor lift create immense friction, which will effect the synthetic fibers of the net. ",Donot put any kind of heavy weight on safety net. Kindly retrain the team,Yes,WhatsApp Image 2026-03-11 at 3.41.50 PM,,Collapse,전도/낙하/부딪힘,붕괴,1.0,1.0
51.0,Hanmi,Rahul Mor,Module GF,12.03.2026,DSHI,"Staircase Access way is full of trip hazards,  materials, electric cable scattered in haphazard manner","Kindly clear the access way of staircase, remove all materials",Yes,WhatsApp Image 2026-03-11 at 8.55.20 AM (1),,Falling,전도/낙하/부딪힘,추락,0.5021,0.4971
52.0,Hanmi,Rahul Mor,Module GF,12.03.2026,DSHI,"Unsafe handling of power tools, standing by putting foot on it & power cable",Do handling of power tools & other materials in safe manner,Yes,WhatsApp Image 2026-03-12 at 8.41.17 AM,,Electric shock,감전/합선,감전,1.0,1.0
53.0,Hanmi,Rahul Mor,Module GF,12.03.2026,Daemyoung,Hydrostatic test pump  Need additional body earthing to be provided for secondary protection ,Kindly provide additional body earthing for the pump,Yes,WhatsApp Image 2026-03-12 at 8.55.47 AM,,Electric shock,감전/합선,감전,1.0,1.0
54.0,Hanmi,Surender Kumar,Module 1F,12.03.2026,Hankuk,Workers were nor removed from lifting work range area ,Kindly barricade the lifting work area & remove all the unauthorized person,Yes,WhatsApp Image 2026-03-12 at 9.05.38 AM,,Falling,떨어짐/낙상,추락,0.416,0.5032
55.0,Hanmi,Rahul Mor,Module GF,12.03.2026,DSHI,"Using of ratchet belts for holding heavy weights without any insulation/packing which will start damaging the ratchet belts ,during further use it will break anytime",Provide proper insulation/packing to avoid the damage of ratchet belt,Yes,WhatsApp Image 2026-03-12 at 9.15.53 AM,,Collapse,전도/낙하/부딪힘,붕괴,1.0,1.0
56.0,Hanmi,Surender Kumar,Module 1F,12.03.2026,Hankuk,Uneven staking of materials,Do proper /safe staking of materials,Yes,WhatsApp Image 2026-03-12 at 9.51.18 AM (2),,Falling,전도/낙하/부딪힘,낙하,0.4829,0.4273
57.0,Hanmi,Surender Kumar,Module 1F,12.03.2026,Hankuk,Unsafe staking height of scaffolding pipes ," Decrease the unsafe staking height , Do not allow to stake the material above safe height",Yes,WhatsApp Image 2026-03-12 at 9.53.25 AM,,Collapse,전도/낙하/부딪힘,붕괴,1.0,1.0
58.0,Hanmi,Rahul Mor,Module 1F,12.03.2026,DSHI,"Verticals pipes were not fixed/placed properly ,out of the base jack which make the jack unsafe & loose also",Do proper arrangement to place the verticals on the base jack ,Yes,KakaoTalk_20260313_081636726_10,,Collapse,전도/낙하/부딪힘,붕괴,1.0,1.0
59.0,Hanmi,Rahul Mor,Module 1F,12.03.2026,DSHI,Scaffolding Joint pin of vertical/standards were not installed in many areas which may lead to  collision of scaffolding ,Provide scaffolding joint pins for all areas,Yes,KakaoTalk_20260313_081636726_06,,Collapse,전도/낙하/부딪힘,붕괴,1.0,1.0
60.0,Hanmi,Rahul Mor,Module 1F,12.03.2026,Hankuk,Avoiding SWL of scaffold  3 person on single scaffold at the same time,Follow SWL of scaffolding ,Yes,KakaoTalk_20260313_081636726_05,,Falling,떨어짐/낙상,추락,0.4712,0.4676
61.0,Hanmi,Rahul Mor,Module GF,13.03.2026,Samho,"Fire hydrant access is blocked ??,  materials stored nearby & infront of fire hydrant system ",Material needs to be removed from infront of fire hydrant for emergency purpose,Yes,WhatsApp Image 2026-03-13 at 8.44.30 AM,,Fire,화재/탄화,화재,1.0,1.0
62.0,Hanmi,Surender Kumar,Module 2F,13.03.2026,DSHI,Hard barricade not available near the edge area at height,Kindly provide hard barricade,Yes,WhatsApp Image 2026-03-13 at 8.48.06 AM,,Falling,전도/낙하/부딪힘,추락,0.3987,0.4053
63.0,Hanmi,Surender Kumar,Module 1F,13.03.2026,Hankuk,Unsafe & uneven staking of materials,Kindly do safe staking of all materials,No,WhatsApp Image 2026-03-13 at 8.49.30 AM (1),,Falling,전도/낙하/부딪힘,낙하,0.4822,0.4046
64.0,Hanmi,Surender Kumar,Module 1F,13.03.2026,Hankuk,"Materials scattered at site,housekeeping after work have not done",Do proper housekeeping at site,Yes,WhatsApp Image 2026-03-13 at 8.57.42 AM (1),,Falling,전도/낙하/부딪힘,낙하,0.4005,0.3664
65.0,Hanmi,Rahul Mor,Module GF,13.03.2026,DSHI,"Need to Clear all weeds and overgrowth within the barricaded area and around the drain. 
Housekeeping not maintained",Kindly clean the area & maintain housekeeping,Yes,WhatsApp Image 2026-03-13 at 9.00.13 AM,,Falling,전도/낙하/부딪힘,낙하,0.4041,0.331
66.0,Hanmi,Surender Kumar,Module 1F,13.03.2026,DSHI,Materials were lifted by fork lift in unsafe manner in loose condition,Kindly do not lift/shift any kind of loose materials,Yes,WhatsApp Image 2026-03-13 at 11.13.46 AM,,Dropping,전도/낙하/부딪힘,낙하,0.4771,0.4291
67.0,Hanmi,Surender Kumar,Module 1F,14.03.2026,DSHI,Material name tag not displayed & barricade for materials storage area was not done at many points.,Do proper barrication & provide material name tag,Yes,,,Falling,전도/낙하/부딪힘,낙하,0.4767,0.4345
68.0,Hanmi,Surender Kumar,Module 1F,14.03.2026,Hankuk,"Poor housekeeping, materials scattered in haphazard manner.",Do proper housekeeping at site,Yes,,,Falling,전도/낙하/부딪힘,낙하,0.4331,0.3873
69.0,Hanmi,Surender Kumar,Module 1F,14.03.2026,Hankuk,"Many unauthorized person were available in lifting work area ,unsafe act & condition.",Kindly remove the unauthorized person from the working area,Yes,,,Falling,전도/낙하/부딪힘,추락,0.4295,0.4596
70.0,Hanmi,Surender Kumar,Module 1F,14.03.2026,DSHI,"Loose & different size of materials were lifted without tighten , chances to fall of materials during lifting","Do not lift / shift didderent size of materials & loose material, kindly retrain the lifting team",Yes,,,Dropping,전도/낙하/부딪힘,낙하,0.412,0.4118
71.0,Hanmi,Surender Kumar,Module 1F,14.03.2026,Hankuk,Workers were found roaming in the unsafe zone or under the boom of concrete pump during concreting work,No one should be allowed under the boom/work area should be banned for unauthorized entry,Yes,,,Impact,전도/낙하/부딪힘,충돌,1.0,1.0
72.0,Hanmi,Surender Kumar,Module 2F,14.03.2026,DSHI,Worker was standing on top railing of scissor lift & out of scissor lift body in unsafe manner even the anchoring point was also not safe/ standard,"Do not allow to stand on any guard railing of any scissor lift,retrain the worker.",Yes,,,Falling,전도/낙하/부딪힘,추락,0.4935,0.5144
73.0,Hanmi,Rahul Mor,Module GF,16.03.2026,DSHI,Before signalman assigning Work started,Kindly provide signalman before start any work on equipments,Yes,WhatsApp Image 2026-03-16 at 8.28.27 AM,,Impact,전도/낙하/부딪힘,충돌,1.0,1.0
74.0,Hanmi,Rahul Mor,Module 1F,16.03.2026,Hankuk,"Protruding rebars in the access way without any rebar caps
Access way is full of trip hazard","Access way should be clear all trip hazard,rebar caps should be provided",Yes,WhatsApp Image 2026-03-16 at 8.35.28 AM,,Falling,전도/낙하/부딪힘,낙하,0.4595,0.3602
75.0,Hanmi,Rahul Mor,Module 1F,16.03.2026,Hankuk,Working at height ( Scaffolding) without anchoring of Safety harness,Kindly anchor the both hooks of safety harness at height work,Yes,WhatsApp Image 2026-03-16 at 8.38.20 AM,,Falling,떨어짐/낙상,추락,0.5176,0.5598
76.0,Hanmi,Rahul Mor,Module 2F,16.03.2026,Hankuk,"Unsafe opening in scaffolding & Uneven much gap in between scaffolding planks
Downside area workers are also working",Kindly close all the opening in the scaffolding area,Yes,WhatsApp Image 2026-03-16 at 8.42.55 AM,,Falling,떨어짐/낙상,추락,0.5241,0.5289
77.0,Hanmi,Rahul Mor,Module 2F,16.03.2026,Hankuk,"Taking shortcut ( unsafe ) to come down by rebars, anchoring in the same ( rebars )",Kindly use safe access way at height,Yes,WhatsApp Image 2026-03-16 at 8.45.51 AM,,Falling,전도/낙하/부딪힘,추락,0.3805,0.3959
78.0,Hanmi,Surender Kumar,Module 1F,16.03.2026,DSHI,working with out any signalman,Kindly provide signalman before start any work on equipments,Yes,WhatsApp Image 2026-03-16 at 8.51.12 AM,,Impact,전도/낙하/부딪힘,충돌,1.0,1.0
79.0,Hanmi,Rahul Mor,Module 1F,16.03.2026,DSHI,Housekeeping not maintained in the working area,Kindly maintain proper housekeeping in all working areas,Yes,WhatsApp Image 2026-03-16 at 8.51.37 AM (1),,Others,기타,기타,1.0,1.0
80.0,Hanmi,Surender Kumar,Module 1F,16.03.2026,DSHI,Signalman was resting/sitting in the lifting area itself/inside the barricade,Kindly rest in the designated rest area only,Yes,WhatsApp Image 2026-03-16 at 9.18.19 AM,,Impact,전도/낙하/부딪힘,충돌,1.0,1.0
81.0,Hanmi,Rahul Mor,Module 1F,16.03.2026,Hankuk,"Loose materials didn't remove from scaffolding access way, chances of fall of materials",Kindly donot put any loose material in the access way of the scaffolding area,Yes,WhatsApp Image 2026-03-16 at 9.27.01 AM,,Dropping,전도/낙하/부딪힘,낙하,0.49,0.484
82.0,Hanmi,Rahul Mor,Module 2F,16.03.2026,Hankuk,"Worker used unsafe access to reach working point ( scaffolding without guard rail system , without lifeline) even no lifeline was there",Kindly follow safe height work procedure,Yes,WhatsApp Image 2026-03-16 at 9.26.56 AM,,Falling,떨어짐/낙상,추락,0.5202,0.5512
83.0,Hanmi,Rahul Mor,Module 2F,16.03.2026,Hankuk,"Improper signaling system for Lifting 
At 2nd floor no one having walkie talkie for clear signaling directly to crane operator
Moreover crane boom crossing under area workers are working, workers weren't removed from lifting work area range",Kindly arrange proper signaling system during lifting (especially for if there is blind spot for operator during lifting),Yes,WhatsApp Image 2026-03-16 at 10.08.56 AM (1),,Impact,전도/낙하/부딪힘,충돌,1.0,1.0
84.0,Hanmi,Rahul Mor,Module 1F,16.03.2026,DSHI,Slippery place to stand & painting work PPE not used,Kindly provide safe platform & job specific PPE,Yes,WhatsApp Image 2026-03-16 at 10.38.57 AM,,Falling,전도/낙하/부딪힘,추락,0.4283,0.4048
