no,company,inspector,location,date,vendor,raw_content,corrective_action,is_completed,photo_before,photo_after,remarks,SDN_risk,Hanmi_risk,SDN_score,Hanmi_score
271.0,Hanmi,Rahul Mor,Module 2F,08.04.2026,Hankuk,"Lots of loose materials [ wedge pin, rebars piece] on green net which need to remove , green net also not tighten properly having gap, risk of falling objects",Kindly remove all the loose materials & donot put any loose materials on green net in the fure again,No,,,Dropping,전도/낙하/부딪힘,낙하,0.397,0.4426
272.0,Hanmi,Rahul Mor,Module 2F,08.04.2026,Hankuk,Lots of unused scaffolding materials are placed which need to be removed especially from access [workers are using the access to the working point at that area],Kindly remove all unnecessary materials from the platform & clear the access,Yes,,,Dropping,떨어짐/낙상,낙하,0.3755,0.403
273.0,Hanmi,Rahul Mor,Module 2F,08.04.2026,Hankuk,"Also give training for safe anchor of safety harness, not to make anchor in/before knots of lifeline",Kindly give retraining for safe anchorage of safety harness,Yes,,,Falling,떨어짐/낙상,추락,0.3599,0.3778
274.0,Hanmi,Surender Kumar,Module GF,08.04.2026,DSHI,No inspection tag on bow shakle,Kindly provide inspection tag gor bow shakles,Yes,,,Others,기타,기타,1.0,1.0
275.0,Hanmi,Rahul Mor,Module 1F,08.04.2026,Hankuk,Scaffolding is not completed yet that area but using for rebar shifting,"Kindly complete the Scaffolding first , don't use incomplete scaffolding",No,,,Falling,떨어짐/낙상,추락,0.4762,0.4858
276.0,Hanmi,Surender Kumar,Module 1F,08.04.2026,Hankuk,Non standar vertical &damaged coupler,Kindly replace those,Yes,,,Collapse,전도/낙하/부딪힘,붕괴,1.0,1.0
277.0,Hanmi,Rahul Mor,Module 2F,09.04.2026,Hankuk,"Lots of loose materials scattered on scaffolding access , no toe guard there & workers are working just downside area","Kindly Remove the unnecessary materials from access way of scaffold platform  Moreover kindly install te guard this area ,downside workers are there",Yes,,,Falling,떨어짐/낙상,추락,0.5702,0.5506
278.0,Hanmi,Rahul Mor,Module 2F,09.04.2026,Hankuk,Missing top railing in scaffolding at height,".Kindly provide guard railings [top railing] for the balance area ,workers are there",Yes,,,Falling,떨어짐/낙상,추락,0.5585,0.575
279.0,Hanmi,Rahul Mor,Module 2F,09.04.2026,Hankuk,Scaffold platform having gap/openings which need to close,Kindly close the gap/opening in scaffolding platform,No,,,Dropping,떨어짐/낙상,추락,0.3396,0.3643
280.0,Hanmi,Rahul Mor,Module 2F,09.04.2026,Hankuk,uneven plank levels create a trip hazard,Kindly rearrange those or provide reflective for clear visibility to avoid stumble upon.,No,,,Falling,전도/낙하/부딪힘,추락,0.4366,0.4112
281.0,Hanmi,Rahul Mor,Module 2F,09.04.2026,Hankuk,All the lifeline that area at scaffolding are without any inspection tag & also not in good condition,Kindly check & provide/replace,Yes,,,Falling,전도/낙하/부딪힘,추락,0.4402,0.4502
282.0,Hanmi,Surender Kumar,Module 2F,09.04.2026,Hankuk,Standing on scaffolding railings in unsafe manner,Kindly stop that work & give training first,Yes,,,Falling,전도/낙하/부딪힘,추락,0.4799,0.4884
283.0,Hanmi,Rahul Mor,Module 1F,09.04.2026,Hankuk,Sharp edges rebars without insulation using in materials shifting trolley,Kindly provide insulation protection  Or use standard handle instead of rebar,No,,,Impact,전도/낙하/부딪힘,충돌,1.0,1.0
284.0,Hanmi,Surender Kumar,Module 2F,09.04.2026,Hankuk,Materials scattered near edge area at height,Kindly remove all the loose materials & donot put any loose materials near edge area in the future again,Yes,,,Dropping,전도/낙하/부딪힘,낙하,0.4713,0.5222
285.0,Hanmi,Rahul Mor,Module 1F,09.04.2026,DSHI,The Korean person working at height in high risky position  1. Anchoring of Safety harness is in bolt hole[ Non - certified anchor point]  2. Hand tools lanyard not connected  3. Sitting/working on narrow column outer part,Kindly revise your SOP for height work & find  safe alternate option,No,,,Falling,떨어짐/낙상,추락,0.4275,0.4854
286.0,Hanmi,Surender Kumar,Module 2F,09.04.2026,Hankuk,Gap/opening in  scaffolding platform,Kindly close,Yes,,,Dropping,떨어짐/낙상,추락,0.4248,0.4479
287.0,Hanmi,Rahul Mor,Module 1F,10.04.2026,DSHI,Gas cylinders in lifting placed which is unsafe,"Kindly Remove gas cylinders trolley from lifting zone, shift to another safe location.",Yes,,,Explosion,화재/탄화,폭발,1.0,1.0
288.0,Hanmi,Rahul Mor,Module 1F,10.04.2026,Hankuk,"materials placed, pipe Shifting work in access way.",Kindly cordon off the pedestrian way  Kindly check & arrange safe access/pedestrian,Yes,,,Dropping,전도/낙하/부딪힘,낙하,0.3503,0.4463
289.0,Hanmi,Rahul Mor,Module 1F,10.04.2026,DSHI,Two scissor lift without any signalman at the location,Kindly check & provide,Yes,,,Others,기타,기타,1.0,1.0
290.0,Hanmi,Rahul Mor,Module 1F,10.04.2026,Hankuk,"Loose materials at platform  just above the pedestrian way ,",kindly Remove,Yes,,,Dropping,전도/낙하/부딪힘,낙하,0.4767,0.4568
291.0,Hanmi,Surender Kumar,Module 1F,10.04.2026,Hankuk,De shuttring workers do not have safety  goggles,Kindly provide ASAP,Yes,,,Impact,전도/낙하/부딪힘,충돌,1.0,1.0
292.0,Hanmi,Rahul Mor,Module 2F,10.04.2026,Hankuk,"Unsafe opening Kindly provide guard railings [No top,mid railing, no toe guard or green net ]for this area or block   till completion",Kindly check & provide,No,,,Falling,떨어짐/낙상,추락,0.3759,0.4099
293.0,Hanmi,Rahul Mor,Module 2F,10.04.2026,Hankuk,Sharp edges rebars in access way without proper insulation & reflective,Kindly provide insulation protection & reflective for each & every rebars [Sharp edges in access] many are still balance,No,,,Impact,전도/낙하/부딪힘,충돌,1.0,1.0
294.0,Hanmi,Rahul Mor,Module 2F,13.04.2026,DSHI,Two workers at height were using the same anchoring point in lifeline,"Retrain the workers to use separate anchorage points and independent lifelines for each person at this height, ensuring proper fall protection and avoiding shared anchors all the time.",Yes,,,Falling,떨어짐/낙상,추락,0.4938,0.5447
295.0,Hanmi,Rahul Mor,Module 2F,13.04.2026,Hankuk,"Safe Access not provided ,still using same unsafe access",Kindly provide safe access to the working point,yes,,,Falling,전도/낙하/부딪힘,낙하,0.3996,0.3401
296.0,Hanmi,Rahul Mor,Module 2F,13.04.2026,Hankuk,"[No guard railings],workers movement are there ",Kindly block  the opening area,yes,,,Falling,떨어짐/낙상,추락,0.4408,0.4614
297.0,Hanmi,Rahul Mor,Module 2F,13.04.2026,Hankuk,Unsafe opening at height,Kindly block ?? that area too ,Yes,,,Falling,전도/낙하/부딪힘,추락,0.4309,0.4706
298.0,Hanmi,Surender Kumar,Module 2F,13.04.2026,Hankuk,Electric cable tied with binding wire [ Sharp edges] cable can be damaged,Kindly Remove ASAP,Yes,,,Electric shock,감전/합선,감전,1.0,1.0
299.0,Hanmi,Rahul Mor,Module 1F,13.04.2026,DSHI,Welding machine in use without the body earthing/grounding cable properly connected.,Kindly connect the body earthing,Yes,,,Electric shock,감전/합선,감전,1.0,1.0
300.0,Hanmi,Rahul Mor,Module 1F,13.04.2026,DSHI,  Hot work (grinding) performed near the substation boundary with inadequate fire booth,Kindly make proper fire booth,Yes,,,Fire,화재/탄화,화재,1.0,1.0
301.0,Hanmi,Rahul Mor,Module 1F,13.04.2026,DSHI,  Grinding machine connection weren't removed  while not in active use,Kindly remove the connection when not in use,Yes,,,Impact,전도/낙하/부딪힘,충돌,1.0,1.0
302.0,Hanmi,Rahul Mor,Module 1F,13.04.2026,DSHI, Worker sitting directly on flexible  conduits (electrical piping) near the substation boundary.,Kindly train the worker not to sit on cable conduit,Yes,,,Electric shock,감전/합선,감전,1.0,1.0
303.0,Hanmi,Rahul Mor,Module 1F,13.04.2026,DSHI,Side support were not provided for beam structure,Kindly provide side support,Yes,,,Collapse,전도/낙하/부딪힘,붕괴,1.0,1.0
304.0,Hanmi,Rahul Mor,Module 1F,14.04.2026,DSHI," Body earthing wire without clamp/holder , not connected ",Kindly connect the earthing cable,No,,,Electric shock,감전/합선,감전,1.0,1.0
305.0,Hanmi,Rahul Mor,Module 1F,14.04.2026,DSHI,"1.  Display the gas cylinder tag 
2.  Use/provide  double chains protection instead of rope [ substandard  ]",Kindly do the compliance,Yes,,,Explosion,화재/탄화,폭발,1.0,1.0
306.0,Hanmi,Surender Kumar,Module 1F,14.04.2026,DSHI,Scissor lift without barricade/signalman in the access way ,Kindly check & provide,Yes,,,Impact,전도/낙하/부딪힘,충돌,1.0,1.0
307.0,Hanmi,Surender Kumar,Module 1F,14.04.2026,DSHI,spider crain  with out TPI,Kindly display the TPI certificate on spider crane,Yes,,,Others,기타,기타,1.0,1.0
308.0,Hanmi,Rahul Mor,Module 1F,14.04.2026,Hankuk,Scaffolding installation team without Scaffolding training ,"Kindly do training & provide training sticker
Check all team of scaffold  ",Yes,,,Others,기타,기타,1.0,1.0
309.0,Hanmi,Rahul Mor,Module 2F,14.04.2026,DSHI,"Risky position
Kindly guide your worker to avoid this type of suspended position at this much height",Use safe platform ,Yes,,,Falling,떨어짐/낙상,추락,0.4695,0.5448
310.0,Hanmi,Surender Kumar,Module GF,14.04.2026,Hankuk,Housekeeping not maintained near staircase area ,Kindly Do the housekeeping & Provide the safe access way for the staircase area,Yes,,,Others,기타,기타,1.0,1.0
311.0,Hanmi,Rahul Mor,Module 1F,14.04.2026,Hankuk,"Toe guard was not provided
Multilevel work was going on in unsafe manner",Kindly provide the toe guard & stop/avoid the multilevel work ,No,,,Dropping,떨어짐/낙상,추락,0.3134,0.3841
312.0,Hanmi,Rahul Mor,Module 1F,14.04.2026,Hankuk,Job specific PPE for concrete  pump operator was not provided & he was standing in unsafe manner,Kindly provide job specific PPE & training need for the opearator of concrete pump,No,,,Entrapment,끼임,협착,1.0,1.0
313.0,Hanmi,Rahul Mor,Module 1F,14.04.2026,DSHI,"There was no chain protection for the co2 gas cylinder,substandard PP rope was tied for the gas cylinder","Kindly provide double chain protection for all the gas cylinders , secure properly",No,,,Explosion,화재/탄화,폭발,1.0,1.0
314.0,Hanmi,Surender Kumar,Module GF,14.04.2026,Hankuk,Signalman for lifting area was not present during lifting/shifting work ,Kindly deploy signalman before starting lifting work especially in the access way (block the access during lifting/shifting),No,,,Impact,전도/낙하/부딪힘,충돌,1.0,1.0
315.0,Hanmi,Rahul Mor,Module 2F,14.04.2026,Hankuk,Worker was siiting on scaffolding without anchoring of safety harness,Kindly ensure anchoring of Safety harness for each & every person at scaffolding ASAP ,No,,,Falling,떨어짐/낙상,추락,0.5205,0.5332
316.0,Hanmi,Rahul Mor,Module GF,15.04.2026,DSHI,"
Housekeeping not maintained & overgrowth of weeds near the drain area near lifting area 
lifeline posts were scattered in haphazard manner","Need to Clear all weeds and overgrowth within the barricaded area and around the drain. 
Place all the posts in even manner properly",Yes,,,Others,기타,기타,1.0,1.0
317.0,Hanmi,Rahul Mor,Module 1F,15.04.2026,Hankuk,Electric cable was touching meatl scaffolding & cable was tied with binding wire,Kindly use insulated hanger for electric cable instead of binding wire,Yes,,,Electric shock,감전/합선,감전,1.0,1.0
318.0,Hanmi,Rahul Mor,Module 1F,15.04.2026,Hankuk,Electric cable were touching the ms scaffold at many points which is very unsafe ,"Kindly check & plan reroute this LT cable (if possible) because this one is touching the scaffolding at many points .
Or use flexible conduits pipe to avoid direct touching to ms scaffolding. ",No,,,Electric shock,감전/합선,감전,1.0,1.0
319.0,Hanmi,Rahul Mor,Module 1F,15.04.2026,DSHI,"Lifeline not tighten properly, Without inspection tag ",Kindly rearrange the lifeline properly & provide inspection tag,Yes,,,Falling,전도/낙하/부딪힘,추락,0.3921,0.3613
320.0,Hanmi,Rahul Mor,Module GF,15.04.2026,Hankuk,"Unsafe Bundling & Lifting of Scaffolding Jacks
Loads was wrapped only with plastic wraps Shifted during lifting",Kindly ensure to rearrange/rebundle  before lifting/shifting,Yes,,,Dropping,전도/낙하/부딪힘,추락,0.3517,0.3789
321.0,Hanmi,Rahul Mor,Module 1F,15.04.2026,DSHI,"Boom lift bucket upside rest area , in rest area workers are there 
No signalman is there","Remove the people from this rest area if working in this range , told to use another rest area ",Yes,,,Dropping,전도/낙하/부딪힘,추락,0.3965,0.4017
322.0,Hanmi,Rahul Mor,Module 2F,15.04.2026,Hankuk,Unsafe opening at height (High risky),Close this ASAP,Yes,,,Falling,전도/낙하/부딪힘,추락,0.3963,0.4356
323.0,Hanmi,Surender Kumar,Module GF,16.04.2026,DSHI,"Incomplete scaffold without inspection tag,steps platform was placed in the access way of staircase","Kindly dismantle the incomplete scaffold without any inspection tag 
Remove the steps platform from Staircase entrance ",Yes,,,Entrapment,끼임,협착,1.0,1.0
324.0,Hanmi,Rahul Mor,Module 2F,16.04.2026,Hankuk,Housekeeping worker at edge area over scaffold with safety harness ,Even housekeeping worker going near the edge area at height over scaffolding then kindly ensure to use Safety harness at that time ,No,,,Falling,떨어짐/낙상,추락,0.4776,0.4925
325.0,Hanmi,Rahul Mor,Module 1F,16.04.2026,Hankuk,Unsafe arrangements for electrical cables,Use insulated hanger instead,Yes,,,Electric shock,감전/합선,감전,1.0,1.0
326.0,Hanmi,Rahul Mor,Module 1F,16.04.2026,DSHI,"Damaged fire blanket used during hot work,safety handle of grinding machine was removed ","Use grinder Safety  handle , clean the area & don't use damaged fire blankets ",Yes,,,Impact,전도/낙하/부딪힘,충돌,1.0,1.0
327.0,Hanmi,Rahul Mor,Module 1F,16.04.2026,Hankuk,"Lifeline ahead this area not available, worker sitting there without anchoring of Safety harness, ",give safe anchoring point & instructed them to anchor all the time,No,,,Falling,떨어짐/낙상,추락,0.4697,0.5094
328.0,Hanmi,Rahul Mor,Module 2F,16.04.2026,Hankuk,Unsafe opening at height ,"Block ??  these both openings, workers are working just nearby ",Yes,,,Falling,전도/낙하/부딪힘,추락,0.4309,0.4706
329.0,Hanmi,Surender Kumar,Module 2F,16.04.2026,Hankuk,Unsafe opening at height ,Kindly check & provide barrier immediately ,Yes,,,Falling,전도/낙하/부딪힘,추락,0.4309,0.4706
330.0,Hanmi,Surender Kumar,Module 1F,16.04.2026,Hankuk,worker was using unsafe access to go upside of scaffolding,Kindly retrain the worker about height safety ,Yes,,,Falling,떨어짐/낙상,추락,0.5084,0.5207
331.0,Hanmi,Rahul Mor,Module 1F,16.04.2026,Hankuk,Joint pins or bolts  inadequately secured at vertical standard connections,Secure/tighten them properly,No,,,Collapse,전도/낙하/부딪힘,붕괴,1.0,1.0
332.0,Hanmi,Rahul Mor,Module 1F,16.04.2026,Hankuk,  power cables tied directly to the metal scaffolding using binding wire,Kindly use insulated hanger for electric cable instead of binding wire,Yes,,,Electric shock,감전/합선,감전,1.0,1.0
333.0,Hanmi,Rahul Mor,Module 1F,16.04.2026,Hankuk, Several horizontal ledgers having bends & deformation.,Kindly check/inspect with competent scaffolding engineer/supervisor & replace the damaged one & retrain your whole scaffolding team,Yes,,,Collapse,전도/낙하/부딪힘,붕괴,1.0,1.0
334.0,Hanmi,Rahul Mor,Module 1F,16.04.2026,Hankuk, Non-standard clamps are being used to join Cuplock components [ also used binding wire ] ,Kindly check/inspect with competent scaffolding engineer/supervisor & replace the damaged one & retrain your whole scaffolding team,No,,,Collapse,전도/낙하/부딪힘,붕괴,1.0,1.0
335.0,Hanmi,Rahul Mor,Module 2F,17.04.2026,DSHI,"Parallel bolting on two levels, boom lift is directly under the scissor lift.","Please Avoid parallel work[risk of fall of materials- bolts,hand tools",No,,,Dropping,전도/낙하/부딪힘,낙하,0.3698,0.3552
336.0,Hanmi,Rahul Mor,Module 2F,17.04.2026,DSHI," Two scissor lift are too close to slab edge, over extended platform, No safety marking [70%]",mark max. extension limits on all lifts.,No,,,Collapse,전도/낙하/부딪힘,붕괴,1.0,1.0
337.0,Hanmi,Rahul Mor,Module 1F,17.04.2026,Hankuk,Worker using/stand on single plank at height in unsafe manner,Kindly use three planks instead of single plank during scaffolding erection [Avoid unsafe condition],Yes,,,Falling,전도/낙하/부딪힘,추락,0.5059,0.5319
338.0,Hanmi,Rahul Mor,Module 1F,17.04.2026,DSHI,The anchoring point is lower than safe height ,Kindly install lifeline post or double lifeline at safe height [As discussed],Yes,,,Falling,떨어짐/낙상,추락,0.4616,0.5145
339.0,Hanmi,Rahul Mor,Module 2F,17.04.2026,DSHI,worker hooked the safety harness in structure with hook on hook anchoring,"Kindly guide your team to avoid hook on hook anchoring of Safety harness , ",Yes,,,Falling,전도/낙하/부딪힘,추락,0.4136,0.4215
340.0,Hanmi,Rahul Mor,Module GF,17.04.2026,DSHI,Side support were not provided for beam structure,"The chains are clearly visible, but please ensure Chains must not be removed until the crane has secured the load. 
That's why Side supports are mandatory to prevent the beams from toppling sideways.",No,,,Collapse,전도/낙하/부딪힘,붕괴,1.0,1.0
341.0,Hanmi,Sangwon Oh,Module 1F,27.03.2026,DSHI,Leakage due to lack of caulking under the electrical compartment,Prevent leakage through caulking in cracks,Yes,,,Leak,LEAK,기타,0.4072,0.2193
,Hanmi,Surender Kumar,Module 1F,18.04.2026,Hankuk,Workers were not using Safety goggles during de shuttering work.,Kindly provide job specific PPE.,Yes,,,Impact,전도/낙하/부딪힘,충돌,1.0,1.0
,Hanmi,Surender Kumar,Module 2F,18.04.2026,DSHI,"Incomplete barrier ,sitting just edge area during erection,not having proper signalman for erection/lifting area",Provide barrier at height & signalman should be there for erection/lifting work,Yes,,,Falling,전도/낙하/부딪힘,추락,0.4017,0.4205
,Hanmi,Surender Kumar,Module 1F,18.04.2026,DSHI,Boom lift operator was sitting in unsafe manner during boom lift operation,Give training to your boom lift opeartor,Yes,,,Impact,전도/낙하/부딪힘,충돌,1.0,1.0
,Hanmi,Surender Kumar,Module 1F,18.04.2026,DSHI,Workers& signalman were sitting in unsafe condition just  near the boom lift tyre during opeartion of boom lift,Kindly give training to your workers not si at site except designated rest area,Yes,,,Impact,전도/낙하/부딪힘,충돌,1.0,1.0
,Hanmi,Surender Kumar,Module 1F,18.04.2026,DSHI,Bow shakle were without inspection tag & monthly color coding,Kindly provide inspection tag,No,,,Others,기타,기타,1.0,1.0
,Hanmi,Surender Kumar,Module 1F,18.04.2026,DSHI,Loose materials were out of material shifting box boundary which is unsafe during lifting/shifting,Kindly ensure not to overflow loose materials above the lifting box body,No,,,Dropping,전도/낙하/부딪힘,낙하,0.3704,0.4077
,Hanmi,Rahul Mor,Module GF,20.04.2026,DSHI,Materials were scattered in haphazarad manner at site in lifting zone,"Kindly do Housekeeping in this area , rearrange the scattered materials ",Yes,,,Others,기타,기타,1.0,1.0
,Hanmi,Rahul Mor,Module GF,20.04.2026,DSHI,No name tag sticker on toolbox,Display the material name tag on toolbox in lifting area ,Yes,,,Others,기타,기타,1.0,1.0
,Hanmi,Rahul Mor,Module GF,20.04.2026,DSHI,Incomple scaffold without any tag & just near the working scissor lift,Dismantle the incomplete scaffold just near scissor lift ,Yes,,,Entrapment,끼임,협착,1.0,1.0
,Hanmi,Rahul Mor,Module GF,20.04.2026,DSHI,"Improper earthing connection found on welding machine, earthing wire is loosely looped through the cable lug rather than being bolted.",Kindly check and do secure earthing connection for welding machine,Yes,,,Electric shock,감전/합선,감전,1.0,1.0
,Hanmi,Surender Kumar,Module 1F,20.04.2026,DSHI,Damaged fire blanket used during hot work,Kindly replace the damaged fire blanket,Yes,,,Fire,화재/탄화,화재,1.0,1.0
,Hanmi,Rahul Mor,Module 2F,20.04.2026,Hankuk,"Missing guard railing/toe board ,materials placed just near the edge","Need to Install toe guard for this area , many materials are nearby & green net also rolled to upside ",Yes,,,Dropping,떨어짐/낙상,낙하,0.3908,0.4256
,Hanmi,Rahul Mor,Module 2F,20.04.2026,Hankuk,Damaged tools found at working site,"Kindly ensure not to use damaged tools, kindly remove the broken/damaged hammer ",Yes,,,Impact,전도/낙하/부딪힘,충돌,1.0,1.0
,Hanmi,Rahul Mor,Module 2F,20.04.2026,Hankuk,Lifeline not completed /balance area,Kindly extant the lifeline rope or top rail to the balance area ,No,,,Falling,전도/낙하/부딪힘,추락,0.4098,0.3202
,Hanmi,Rahul Mor,Module 2F,20.04.2026,Hankuk,No access to the working point,Kindly provide access to the working point ,No,,,Falling,전도/낙하/부딪힘,낙하,0.4548,0.4534
,Hanmi,Rahul Mor,Module 2F,20.04.2026,Hankuk,Materials were placedon the green net in unsafe manner,Kindly Remove the shuttering tie from green net & install toe guard if possible that balance area ,No,,,Dropping,전도/낙하/부딪힘,낙하,0.4131,0.4271
,Hanmi,Rahul Mor,Module 1F,20.04.2026,Hankuk,Worker using safety harness to pulling materials in unsafe manner,"Kindly train your workers, safety harness is not for this type of work [pulling] ",No,,,Entrapment,끼임,협착,1.0,1.0
,Hanmi,Rahul Mor,Module 1F,20.04.2026,Hankuk,Damaged lifting sling found with torn protective sleeve and improper wire stitching repair,Kindly Remove this sling from site ,No,,,Collapse,전도/낙하/부딪힘,붕괴,1.0,1.0
,Hanmi,Rahul Mor,Module 1F,20.04.2026,Hankuk,Without inspection tag shakle ,Kindly check/provide the inspection tag for both shakle ,No,,,Others,기타,기타,1.0,1.0
,Hanmi,Rahul Mor,Module 1F,20.04.2026,DSHI,"1.  Improper Termination (Knots) at the end of lifeline rope 
2.  The lifeline rope is wrapped directly around sharp metal edges, kindly use/provide softeners or padding to prevent abrasion.",Kindly secure the lifeline properly & make 8 type knot,No,,,Falling,떨어짐/낙상,추락,0.4147,0.4391
,Hanmi,Rahul Mor,Module 2F,20.04.2026,Hankuk,Damaged green net,Kindly rearrange the green net ,Yes,,,Falling,전도/낙하/부딪힘,낙하,0.5406,0.5009
,Hanmi,Rahul Mor,Module 2F,20.04.2026,DSHI," Worker Going to upside area [ over purlin ] in unsafe manner by standing on mid railing, top railings , upside also  
High risk activity is being carried out in very unsafe manner  ","Use safe method
kindly check if any secondary fall protection you can arrange other than safety harness",No,,,Falling,전도/낙하/부딪힘,추락,0.4905,0.5115
,Hanmi,Rahul Mor,Module 2F,20.04.2026,DSHI,one signalman & one worker were sitting just near scissor lift while scissor lift was in operation ,Kindly give training to your workers ,Yes,,,Impact,전도/낙하/부딪힘,충돌,1.0,1.0
,Hanmi,Rahul Mor,Module 2F,21.04.2026,Hankuk,Worker was found without anchoring of safety harness during de shuttering work.,"Kindly ensure each & every person in de shuttering team must anchor the safety harness, one of them is not anchored ",yes,,,Falling,떨어짐/낙상,추락,0.4262,0.4861
,Hanmi,Rahul Mor,Module 2F,21.04.2026,Hankuk,"All ladder [ used as temporary access] are in loose condition,  ",kindly fix/secure them all ,Yes,,,Entrapment,끼임,협착,1.0,1.0
,Hanmi,Rahul Mor,Module 2F,21.04.2026,Hankuk,"Much opeing in rebars ,need to provide cover","Kindly place plywood temporarily for now ,cover the area ",Yes,,,Entrapment,끼임,협착,1.0,1.0
,Hanmi,Rahul Mor,Module 2F,21.04.2026,Hankuk,"This rope is in damaged condition, kindly replace",  don't use this type of damaged rope,Yes,,,Falling,전도/낙하/부딪힘,추락,0.4343,0.447
,Hanmi,Rahul Mor,Module 2F,21.04.2026,Hankuk,Without fire booth hot work going to be start,"Kindly make fire booth first, there are lots of flammable materials ",Yes,,,Fire,화재/탄화,화재,1.0,1.0
,Hanmi,Rahul Mor,Module 2F,21.04.2026,Hankuk,"There are no guard railings for this area [ top,mid,toe guard] Moreover the gap/opening in platform",Kindly provide guard railing & close the opening area,Yes,,,Falling,떨어짐/낙상,추락,0.4569,0.4545
,Hanmi,Rahul Mor,Module 1F,21.04.2026,Hankuk,"Instructed yesterday also to remove metal wires from web slings.
Using metal wire on web slings is unsafe. The wire pinches and cuts the load-bearing fibers under the cover, which can cause sling failure.","Remove all metal wires immediately. 
Use safe alternatives like heavy-duty Velcro wear pads or sling protection sleeves.",Yes,,,Collapse,전도/낙하/부딪힘,붕괴,1.0,1.0
,Hanmi,Rahul Mor,Module 2F,22.04.2026,Hankuk,Mid railing was not installed at edge area,Kindly complete the guard railings     [if possible] ,Yes,,,Falling,전도/낙하/부딪힘,추락,0.4668,0.4723
,Hanmi,Rahul Mor,Module 2F,22.04.2026,Hankuk,Opening area barrier not provided,Kindly shift the barrier rope to the edge point,Yes,,,Falling,전도/낙하/부딪힘,낙하,0.4582,0.4112
,Hanmi,Rahul Mor,Module 2F,22.04.2026,Hankuk,Unsafe working platform,Kindly arrange safe working  platform ,No,,,Falling,전도/낙하/부딪힘,추락,0.4979,0.5203
,Hanmi,Rahul Mor,Module 1F,22.04.2026,Hankuk,"Kindly check, he didn't anchor safety harness, opening is just behind ",Kindly ensure anchoring of safety harness all the time at height,Yes,,,Falling,떨어짐/낙상,추락,0.4159,0.4355
,Hanmi,Rahul Mor,Module 2F,22.04.2026,Hankuk,"Opening area , without barrier workers are just nearby 
Kindly block 🚫  that area ahead & close the platform opening ",Kindly provide barrier for this area ,No,,,Falling,떨어짐/낙상,추락,0.4465,0.4784
